<!-- edited with XML Spy v4.2 U (http://www.xmlspy.com) by Aminadabe (Aminadabe) -->
<!--Sample XML file generated by XML Spy v4.2 (http://www.xmlspy.com)-->
<Biblioteca xmlns:xsi="http://www.w3.org/2001/XMLSchema-instance" xsi:noNamespaceSchemaLocation="C:\Eclipse\workspace\Correlação de Alarmes\cnf\biblioteca.xsd">
	<Componente id="adf" nome="Add Drop Filter" selfalarm="true"/>
	<Componente id="rx" nome="Receive" outalarm="true"/>
	<Componente id="tx" nome="Transmiter" selfalarm="true" maskalarm="true"/>
	<Componente id="r3" nome="Regenerador 3 Estados" outalarm="true"/>
	<Componente id="ps" nome="Protect Switch" outalarm="true"/>
	<Componente id="sw" nome="Switch" selfalarm="true"/>
	<Componente id="lap" nome="Local Acess Port"/>
	<Componente id="mux" nome="Mutiplexador"/>
	<Componente id="demux" nome="Demutiplexador"/>
	<Componente id="fibra" nome="Fibra Otica"/>
	<Elemento id="nl" tipo="Local" nome="Nó Local">
		<Componentes idComp="adf" idMas="1x01"/>
		<Componentes idComp="rx" idMas="2x01"/>
		<Componentes idComp="r3" idMas="2x04"/>
		<Componentes idComp="ps" idMas="2x03"/>
		<Componentes idComp="lap" idMas="2x05"/>
		<Componentes idComp="tx" idMas="3x05"/>
	</Elemento>
	<Elemento id="nc" tipo="Central" nome="Nó Central">
		<Componentes idComp="demux"/>
		<Componentes idComp="ps"/>
		<Componentes idComp="r3"/>
		<Componentes idComp="sw"/>
		<Componentes idComp="adf"/>
		<Componentes idComp="mux"/>
	</Elemento>
	<SubElemento id="nli" idElemento="nl" posicao="inicial" nome="Sub Nó Local Inicial">
		<Componentes idComp="lap" idMas="0x00"/>
		<Componentes idComp="tx" idMas="3x0e"/>
		<Componentes idComp="adf" idMas="1x0a"/>
	</SubElemento>
	<SubElemento id="nlp" idElemento="nl" posicao="passagem" nome="Sub Nó Local de Passagem">
		<Componentes idComp="fibra" idMas="00yx"/>
		<Componentes idComp="lap" idMas="1x0a"/>
	</SubElemento>
	<SubElemento id="nlf" idElemento="nl" posicao="final" nome="Sub Nó Local Final">
		<Componentes idComp="fibra" idMas="00yx"/>
		<Componentes idComp="adf" idMas="1x0a"/>
		<Componentes idComp="rx" idMas="2x0a"/>
		<Componentes idComp="r3" idMas="2x0d"/>
		<Componentes idComp="ps" idMas="2x03"/>
		<Componentes idComp="lap" idMas="0x00"/>
	</SubElemento>
	<SubElemento id="nci" idElemento="nc" posicao="inicial" nome="Sub Nó Central Inicial">
		<Componentes idComp="lap" idMas="0x00"/>
		<Componentes idComp="sw" idMas="1x01"/>
		<Componentes idComp="tx" idMas="3x0z"/>
		<Componentes idComp="mux" idMas="0x10"/>
	</SubElemento>
	<SubElemento id="ncp" idElemento="nc" posicao="passagem" nome="Sub Nó Central de Passagem">
		<Componentes idComp="fibra" idMas="00yx"/>
		<Componentes idComp="demux" idMas="0x0y"/>
		<Componentes idComp="ps" idMas="2xz1"/>
		<Componentes idComp="rx" idMas="2xz2"/>
		<Componentes idComp="r3" idMas="2xz3"/>
		<Componentes idComp="sw" idMas="1x01"/>
		<Componentes idComp="tx" idMas="3x0z"/>
		<Componentes idComp="mux" idMas="0x10"/>
	</SubElemento>
	<SubElemento id="ncf" idElemento="nc" posicao="final" nome="Sub Nó Central Final">
		<Componentes idComp="fibra" idMas="00xy"/>
		<Componentes idComp="demux" idMas="0x0y"/>
		<Componentes idComp="ps" idMas="2xz1"/>
		<Componentes idComp="rx" idMas="2xz2"/>
		<Componentes idComp="r3" idMas="2xz3"/>
		<Componentes idComp="sw" idMas="1x01"/>
		<Componentes idComp="lap" idMas="0x00"/>
	</SubElemento>
</Biblioteca>
